{"edges":[{"from":"front_end_intake","reason":"contract_sequence","to":"semantic_preflight"},{"from":"semantic_preflight","reason":"contract_sequence","to":"optimization"},{"from":"optimization","reason":"contract_sequence","to":"emission"}],"graph_id":"graph.C1","nodes":[{"id":"front_end_intake","kernel_refs":["repo_auditor_kernel"],"outputs":["FRONT_END_INTAKE.md"],"phase":"lock context","status":"planned"},{"id":"semantic_preflight","kernel_refs":["K01","K02","K03","K04","K05"],"outputs":["SEMANTIC_PREFLIGHT.md"],"phase":"run constitutional preflight","status":"planned"},{"id":"optimization","kernel_refs":["recursive_improvement"],"outputs":["OPTIMIZATION.md"],"phase":"run recursive improvement","status":"planned"},{"id":"emission","kernel_refs":["flawless_victory"],"outputs":["EMISSION.md"],"phase":"execute terminal doctrine only after gates pass","status":"planned"}],"source_contract":"C1","terminal_node":"emission","validation_gates":["format"]}